ar-title;ar-title href;ar-meta href;ar-pub;ar-year;ar-cited;ar-quartile;abstract;
Application of The MOORA Method and Rank Order Centroid for Admission Recommendation System Power Programmer;https://jurnal.unimed.ac.id/2012/index.php/cess/article/view/29686/pdf;https://sinta.kemdikbud.go.id/journals/profile/207?page=14#!;CESS (Journal of Computer Engineering, System and Science) Vol 7, No 1 (2022): January 2022 253-261;2022;DOI: 10.24114/cess.v7i1.29686;Accred : Sinta 4;﻿Riset ini bertujuan untuk menerapkan sistem pendukung keputusan menggunakan kombinasi metode MOORA dengan pembobotan Rank Order Centroid pada penentuan rekomendasi dalam penerimaan tenaga programmer. Kriteria yang dijadikan sebagai parameter dan tolak ukur dalam penilaian penerimaan tenaga programmer pada penelitian ini sebanyak 7 kriteria yang terdiri atas HTML dan CSS (C1), Jquery dan Javascript (C2), PHP (C3), Java (C4), Android (C5), .NET (C6), dan MySQL (C7). Sampel data yang diujikan pada penelitian ini berjumlah 5 alternatif dari data pelamar yang mengajukan diri sebagai tenaga programmer. Hasil yang diperoleh yaitu RRH (A2) memperoleh nilai preferensi akhir tertinggi yaitu 0.50. Kemudian NAS (A5) memperoleh nilai preferensi terkecil dari 5 sampel data yang diujikan dengan nilai preferensi yang diperoleh yaitu 0.41. Pengujian yang dilakukan dengan menerapkan metode yang diusulkan memperoleh hasil yaitu dapat memberikan keputusan rekomendasi pelamar yang layak untuk diterima pada posisi tenaga programmer.;
E-Commerce User Satisfaction Analysis Using Usability Scale System and Pieces Framework;https://jurnal.unimed.ac.id/2012/index.php/cess/article/view/30752/pdf;https://sinta.kemdikbud.go.id/journals/profile/207?page=14#!;CESS (Journal of Computer Engineering, System and Science) Vol 7, No 1 (2022): January 2022 262-274;2022;DOI: 10.24114/cess.v7i1.30752;Accred : Sinta 4;﻿Perkembangan teknologi yang terjadi saat ini membawa perubahan dibidang ekonomi,e- commerce salah satu bentuk perkembangan teknologi di bidang ekonomi, dengan e- commerce pelanggan tidak harus datang langsung ke toko untuk membeli barang. Dalam mengelola e-commerce diperlukan perawatan khusus untuk memastikan e-commerce berjalan sebagaimana mestinya, salah satu caranya yaitu melakukan analisis kepuasan pengguna menggunakan Teknik usability yaitu melakukan penggujian kepada pengguna.Pengujian ini menggunakan metode Sistem Usablity Scale dan PIECES Framework dimana Sistem Usabiliti Scale memiliki 10 pertanyaan dan PIECES Framework memiliki 6 indikator.Hasil dari dari pengujian menghasilkan skor 69 dan metode PIECES Framework menghasilkan nilai yang memuaskan dimana performance mendapatkan nilai 3.21 information mendapatkan nilai 3.7, economic mendapatkan nilai 3.54, control mendapatkan nilai 3.24 efficiency mendapatkan nilai 3,07 dan yang terakhir service dengan nilai 3.27 dengan total skor rata rata sebesar 3,33.Hasil dari penelitian ini menunjukan bahwa pengujian dengan menggunakan metode PIECES Framework menghasilkan metode yang lebih tinggi dari pada metode SUS.;
Decision Support System with SMART Method in Regional Manager Selection;https://jurnal.unimed.ac.id/2012/index.php/cess/article/view/32170/pdf;https://sinta.kemdikbud.go.id/journals/profile/207?page=15#!;CESS (Journal of Computer Engineering, System and Science) Vol 7, No 1 (2022): January 2022 275-288;2022;DOI: 10.24114/cess.v7i1.32170;Accred : Sinta 4;﻿Dalam suatu perusahaan meskipun bukan merupakan jabatan yang paling tinggi, manajer merupakan salah satu posisi utama bagi karyawan di perusahaan dikarenakan manajer berperan sebagai perantara antara karyawan dan kepentingan perusahaan sehingga proses pemilihannya tidak mungkin dilakukan dengan sembarangan. PT World Innovative Telecommunication (OPPO) adalah salah satu perusahaan elektronik dan komunikasi seluler. Di perusahaan OPPO tim perusahaan masih melakukan kegiatan penilaian secara manual. Maka akan dilakukan pembuatan sistem dengan strategi metode SMART (Simple Multi Attribute Rating Technique) yang dapat menangani pemilihan manajer secara efektif dan cepat sangat dibutuhkan dalam proses pemilihan Regional Manager di Perusahaan OPPO. Penelitian ini bertujuan mempermudah pemilihan regional manager dengan metode sederhana dan membutuhkan periode singkat untuk perusahaan. Adapun kriteria dan bobot yang digunakan yaitu C1 = pengalaman kerja (30%), C2 = aspek kecerdasan (25%), C3 = = sikap dan kepribadian (20%), C4 = pendidikan (15%), C5 = usia (10%). Terdapat 25 Alternatif yang memungkinkan untuk menjadi kandidat untuk pemilihan Regional Manager, dan hasil yang didapatkan adalah Zhu Le Jun dengan ranking tertinggi yaitu dengan nilai 0,86. Penelitian ini menghasilkan sebuah keputusan dengan metode SMART untuk pemilihan Regional Manager.;
Biometric Technology Using Eigenface Algorithm;https://jurnal.unimed.ac.id/2012/index.php/cess/article/view/28918/pdf;https://sinta.kemdikbud.go.id/journals/profile/207?page=13#!;CESS (Journal of Computer Engineering, System and Science) Vol 7, No 1 (2022): January 2022 43-54;2022;DOI: 10.24114/cess.v7i1.28918;Accred : Sinta 4;﻿Penelitian ini membahas tentang teknologi biometrik yang digunakan untuk mengenali pola fisik dari seseorang sehingga dapat teridentifikasi. Focus biometrik yang akan diteliti adalah deteksi wajah. Hal ini dilakukan karena melihat kurang optimalnya pengenalan biometrik pada sidik jari yang rentan tidak terdeteksi akibat luka atau perubahan struktur kulit seseorang. Teknologi biometrik wajah ini dapat digunakan untuk mengenali seseorang dalam melakukan perekaman data seperti pengelolaan biodata pegawai, masyarakat dan absensi. Untuk membangun teknologi biometrik tersebut maka dibutuhkan sebuah algoritma yang mampu melakukan pengenalan pola yaitu Eigenface. Algoritma tersebut telah teruji dan banyak digunakan pada penelitian sebelumnya dalam pengenalan pola, sehingga sangat tepat untuk digunakan dalam penelitian ini. Proses pengenalan wajah dimulai dengan mengambil citra wajah sehingga akan memperoleh nilai RGB, kemudian melakukan konversi dari RGB ke grayscale. Setelah proses konversi selesai maka selanjutnya mengubah citra tersebut ke dalam bentuk matriks dan menghitung nilai Flatvektor sehingga nantinya akan dicari nilai kedekatan dari data citra yang direkam. Dari hasil penelitian yang dilakukan maka diperoleh hasil bahwa algoritma Eigenface telah berhasil melakukan pengenalan wajah dengan akurasi 100% dari 10 data uji. Pengujian akurasi dilakukan dengan insitas cahaya 10 sampai dengan 1000 Lux, jarak antara 30 sampai dengan 200 cm dan gerak objek diatas 4 detik.;
Virtual Tour Reality Application Using Panoramic Image Method for Introduction to Semarang University Campus;https://jurnal.unimed.ac.id/2012/index.php/cess/article/view/28178/pdf;https://sinta.kemdikbud.go.id/journals/profile/207?page=14#!;CESS (Journal of Computer Engineering, System and Science) Vol 7, No 1 (2022): January 2022 55-66;2022;DOI: 10.24114/cess.v7i1.28178;Accred : Sinta 4;﻿Saat ini, kita tengah mengalami pandemi covid 19. Pandemi ini mengakibatkan beberapa kesulitan diberbagai bidang yang salah satunya adalah bidang pendidikan. Hal ini disebabkan adanya peraturan pemerintah yang memberlakukan kegiatan belajar dari rumah. Universitas Semarang menjalankan peraturan pemerintah sampai pandemi dapat teratasi. Hal ini menyebabkan pihak kampus kesulitan ketika akan mengenalkan lingkungan kampus pada mahasiswa baru. Sehingga penerapan teknologi media informasi sangat dibutuhkan. Virtual Tour merupakan perkembangan teknologi pada bidang fotografi. Dengan menggunakan teknologi virtual tour pengguna solah-olah akan berada didunia nyata. Penelitian ini memanfaatkan teknologi tersebut untuk mengenalkan lingkungan kampus kepada mahasiswa baru. Penelitian ini menghasilkan sebuah aplikasi virtual tour dengan metode panorama 360°. Metode yang digunakan untuk pengembangan aplikasi adalah metode Multimedia Development Life Cicle (MDLC) dari Luther-Sutopo. Berdasarkan hasil pengujian aplikasi menggunakan black- box, penulis menyimpulkan bahwa aplikasi dapat digunakan sesuai dengan fungsi yang ada dikesuluran aplikasi. Dengan adanya penerapan teknologi virtual tour di lingkungan Universitas Semarang, diharapkan dapat dimanfaatkan untuk pengenalan lingkungan kampus pada mahasiswa baru Universitas Semarang tanpa harus berkumpul atau datang langsung ke Universitas Semarang.;
Comparison of Accuracy in NaÃ¯ve Bayes and Random Forests in Classification of Liver Disease;https://jurnal.unimed.ac.id/2012/index.php/cess/article/view/28888/pdf;https://sinta.kemdikbud.go.id/journals/profile/207?page=15#!;CESS (Journal of Computer Engineering, System and Science) Vol 7, No 1 (2022): January 2022 81-89;2022;DOI: 10.24114/cess.v7i1.28888;Accred : Sinta 4;﻿Pada penelitian ini bertujuan untuk melakukan komparasi terhadap metode Naïve Bayes dan Random Forest dalam klasifikasi data pasien penyakit liver. Adapun data pengujian yang digunakan yaitu Indian Liver Patient Dataset (ILPD) yang diperoleh dari UCI iMachine Learning iRepository. Dataset tersebut memiliki 583 record data, 10 kriteria, dan 1 variable kelas serta dengan jumlah kelas sebanyak 2 kelas atribut, serta data set tersebut berjenis multivariate. Terdapat beberapa tahapan preprocessing yang dilakukan, antara lain normalisasi data yang diujikan, selanjutnya dilakukan analisis klasifikasi menggunakan metode naïvebayes dan random forest. Berdasarkan hasil pengujian yang dilakukan dalam memperoleh nilai akurasi perhitungan klasifikasi menggunakan Confusion Matrix, maka metode Random Forest memperoleh hasil yang terbaik yaitu dengan peroleh akurasi sebesar 70.60 % bila dibandingkan dengan Naïve Bayes yang hanya memperoleh akurasi sebesar 55.80%. Sehingga Random Forest memiliki performa kinerja yang lebih unggul dalam perolehan akurasi yang dihasilkan dalam klasifikasi penyakit liver.;
Kernel Comparison on Support Vector Machine for Detecting Stairs Descent;https://jurnal.unimed.ac.id/2012/index.php/cess/article/view/33477/pdf;https://sinta.kemdikbud.go.id/journals/profile/207?page=16#!;CESS (Journal of Computer Engineering, System and Science) Vol 7, No 2 (2022): July 2022 289-298;2022;DOI: 10.24114/cess.v7i2.33477;Accred : Sinta 4;﻿Terdapat 4 kernel yang dapat digunakan dalam klasifikasi Support Vector Machine dalam membuat hyperplane. Keempat kernel tersebut adalah linear, polynomial, gaussian dan sigmoid. Setiap kernel dapat menghasilkan akurasi yang berbeda-beda. Hal ini dikarenakan pengaruh sebaran data yang diklasifikasikan. Terdapat 2 kelas yang diklasifikasikan, yaitu lantai dan tangga turun. Dilakukan proses ekstraksi fitur tekstur terhadap citra lantai dan tangga turun menggunakan metode Gray Level Co-occurence Matrix. Terdapat 7 fitur dari GLCM yang dihasilkan pada proses ekstraksi fitur. Selanjutnya dilakukan klasifikasi menggunakan Support Vector Machine dengan mencoba setiap kernelnya. Dari hasil pengujian didapatkan kernel linear menghasilkan akurasi yang paling tinggi, yaitu 89%. Kernel sigmoid mendapatkan akurasi 84%. Kernel Gaussian mendapatkan akurasi sebesar 85%. Sedangkan kernel polynomial mendapatkan akurasi yang paling rendah yaitu 78%.;
Decision Support System For Teacher Performance Assessment at the Yayasan Pendidikan Islam Al-Islamiyah with the Analytical Hierarchy Process Method (AHP);https://jurnal.unimed.ac.id/2012/index.php/cess/article/view/34980/pdf;https://sinta.kemdikbud.go.id/journals/profile/207?page=16#!;CESS (Journal of Computer Engineering, System and Science) Vol 7, No 2 (2022): July 2022 299-314;2022;DOI: 10.24114/cess.v7i2.34980;Accred : Sinta 4;﻿Penelitian ini berfokus pada pembangunan Sistem penunjang keputusan (SPK) untuk penilaian kinerja guru pada Yayasan Pendidikan Islam Al-Islamiyah. Dalam sebuah instansi pendidikan sekolah mempunyai guru yang merupakan asset yang harus dimiliki sekolah dalam menciptakan proses pendidikan yang bermutu. Permasalahan yang terjadi pada yayasan ini adalah belum adanya metode yang tepat dan aplikasi sistem penilaian kinerja guru, serta banyaknya jumlah guru yang ada, sehingga sulit menilai kinerja guru, sehingga kesulitan melakukan pemilihan guru terbaik. Oleh sebab itu, dibutuhkan metode yang tepat dan SPK untuk mengatasi kendala yang ada. Metode Analytical Hierarchy Process (AHP) adalah salah satu metode yang dapat digunakan dalam menentukan penilaian kinerja guru terbaik dalam menentukan penilaian kinerja guru. Kriteria yang telah ditetapkan yaitu berdasarkan kepada kehadiran, kerapian berpakaian, disiplin, kemampuan mengajar, dan tanggung jawab. Penelitian ini bertujuan menentukan metode yang tepat dan membangun SPK untuk penilaian kinerja guru pada sekolah Yayasan Pendidikan Islam Al-Islamiyah dalam menentukan guru terbaik. SPK ini menghasilkan urutan prioritas alternatif, yang dapat digunakan sebagai alat bantu pemecahan masalah dalam menentukan penilaian kinerja guru dan memilih guru terbaik.;
Decision Tree and K-Nearest Neighbor (K-NN) Algorithm Based on Particle Swarm Optimization (PSO) for Diabetes Mellitus Prediction Accuracy Analysis;https://jurnal.unimed.ac.id/2012/index.php/cess/article/view/34245/pdf;https://sinta.kemdikbud.go.id/journals/profile/207?page=15#!;CESS (Journal of Computer Engineering, System and Science) Vol 7, No 2 (2022): July 2022 315-324;2022;DOI: 10.24114/cess.v7i2.34245;Accred : Sinta 4;﻿Penyakit Diabetes Mellitus merupakan penyakit tidak menular, tetapi penyakit ini merupakan salah satu penyakit yang mematikan bagi yang mengidapnya. Penyakit ini disebabkan oleh beberapa factor diantaranya pola makan hidup yang tidak teratur atau berlebihan. Apabila penyakit ini tidak dihentikan, maka penderita penyakit Diabetes Mellitus akan semakin memakan para pasien penderita penyakit ini. Menurut WHO atau World Health Organization, sekitar 425 juta orang menderita penyakit diabetes, kemudian 1,6 juta kematian setiap tahunnya di akibatkan oleh penyakit diabetes. Kemudian, pada tahun 2016 di Indonesia, kematian yang disebabkan oleh penyakit diabetes sekitar 99 ribu jiwa. Penyakit diabetes pada tahun ke tahun semakin meningkat, jadi perlu adanya sebuah sistem yang dapat membantu medis untuk melakukan klasifikasi terhadap diabetes berdasarkan data kesehatan pasien. Salah satu metode yang dapat digunakan untuk memprediksi penyakit diabetes mellitus adalah dengan menggunakan data mining. Data mining merupakan suatu proses yang interaktif untuk memprediksi penyakit diabetes mellitus. Prediksi untuk mendiagnosis penyakit ini menggunakan seleksi fitur berbasis Particle Swarm Optimization (PSO) pada dataset Kaggle.com dan metode klasifikasi yang digunakan yaitu metode Decision Tree dan K- Nearest Neighbors (K-NN). Hasil dari penelitian ini menghasilkan nilai akurasi tertinggi sebanyak 79.8% dengan AUC 0.71 dengan menggunakan metode Decision Tree, dan untuk menggunakan optimasi metode K-Nearest Neighbors (K-NN) menggunakan Particle Swarm Optimization (PSO) memiliki nilai akurasi tertinggi sebanyak 77.09%.;
Forecasting Room Occupancy Rates Based on Hotel Class in Bali Using the ARIMA Method;https://jurnal.unimed.ac.id/2012/index.php/cess/article/view/33959/pdf;https://sinta.kemdikbud.go.id/journals/profile/207?page=15#!;CESS (Journal of Computer Engineering, System and Science) Vol 7, No 2 (2022): July 2022 325-339;2022;DOI: 10.24114/cess.v7i2.33959;Accred : Sinta 4;﻿Bali merupakan destinasi wisata di Indonesia yang diminati oleh wisatawan dan didukung oleh ketersediaan hotel yang memadai. Covid-19 yang melanda dunia termasuk Bali telah mengakibatkan tingkat penghunian kamar (TPK) hotel mengalami penurunan drastis. Oleh karena itu, perlu upaya untuk kembali menaikkan rata-rata TPK hotel. Salah satu langkah awal yang yang diharapkan mampu berkontribusi dalam upaya ini adalah dengan melakukan peramalan TPK hotel. Hasil peramalan dengan metode ARIMA diperoleh hasil bahwa pada hotel bintang lima, model terbaik yang diperoleh yakni model ARIMA (0,1,1) dengan MSE sebesar 39,65% dan MAPE sebesar 80,83%. Pada hotel bintang empat, model terbaik yang diperoleh yakni model ARIMA (1,0,2) dengan MSE sebesar 24,14% dan MAPE sebesar 60,14%. Pada hotel bintang tiga, model terbaik yang diperoleh yakni model ARIMA (1,0,0) dengan MSE sebesar 25,57% dan MAPE sebesar 59,11%. Pada hotel bintang dua, model terbaik yang diperoleh yakni model ARIMA (1,0,1) dengan nilai MSE sebesar 13,29% dan MAPE sebesar 68,00%. Pada hotel bintang satu, model ARIMA (1,0,1) merupakan model terbaik berdasarkan nilai MSE dengan persentase sebesar 19,49%, sedangkan model ARIMA (1,0,0) merupakan model terbaik berdasarkan nilai MAPE dengan persentase sebesar 431,12%.;
Comparative Audit of Batam City Information System and COVID-19 National Website;https://jurnal.unimed.ac.id/2012/index.php/cess/article/view/32354/pdf;https://sinta.kemdikbud.go.id/journals/profile/207?page=16#!;CESS (Journal of Computer Engineering, System and Science) Vol 7, No 2 (2022): July 2022 340-354;2022;DOI: 10.24114/cess.v7i2.32354;Accred : Sinta 4;﻿Penggunaan Teknologi Informasi (TI) untuk pusat informasi dalam web COVID-19 di kota Batam dan web COVID-19 di Indonesia, harus didukung oleh IT Governance yang melukiskan faktor terpenting dalam penggunaan TI. Selain itu, perkembangan internet juga mendukung penggunaan komputer. Data-data yang ada pada kedua website tersebut kemungkinan masih belum bisa dijadikan data referensi utama dikarenakan perbedaan data dari web versi nasional dan Kota Batam, juga dikarenakan data yang diperoleh tidak selaras dan tidak bersinggungan, hal itu dapat menyebabkan kesalahan dalam pelaporan data yang sudah dikumpulkan sedemikian rupa. Dalam penelitian ini dilakukan Audit Sistem Informasi dengan proses pengumpulan dan juga pengevaluasian bukti tentang keakuratan dari informasi yang ada untuk menentukan tingkat kecocokan informasi tersebut dengan standar audit yang sudah ditetapkan dan mengutarakan hasil pemeriksaan tersebut, berlandaskan pada standar audit sistem informasi. Hasil dari penilaian aspek sistem keamanan, desain, navigasi, mobile friendly, kecepatan, kualitas konten dan kata kunci kedua web tersebut memperlihatkan bahwa website tersebut sudah sangat layak untuk dikatakan baik sekali.;
Video Streaming Data Security Using AES-Rijndael Algorithm;https://jurnal.unimed.ac.id/2012/index.php/cess/article/view/32989/pdf;https://sinta.kemdikbud.go.id/journals/profile/207?page=16#!;CESS (Journal of Computer Engineering, System and Science) Vol 7, No 2 (2022): July 2022 355-367;2022;DOI: 10.24114/cess.v7i2.32989;Accred : Sinta 4;﻿Keamanan merupakan salah satu aspek yang paling penting dalam jalannya proses pertukaran informasi di masa ini. Tidak semua informasi yang dipertukarkan dapat diperbolehkan menjadi konsumsi publik apalagi jika jatuh ke tangan pihak yang tidak bertanggung jawab yang dapat mengubah, memanipulasi dan menyebarkan informasi tersebut tanpa izin. Salah satu bentuk informasi yang perlu dilakukan langkah pengamanan ialah data video streaming. Metode enkripsi adalah pilihan yang paling tepat untuk mengamankan kerahasiaan data tersebut. Enkripsi merupakan sebuah ilmu untuk mengkonversikan sebuah data menjadi bentuk yang tidak dapat dimengerti guna menyembunyikan informasi yang hanya dapat diakses oleh pihak yang berhak. Penelitian ini membangun sebuah prototipe untuk mengamankan data video streaming dan jalur transmisinya dengan memanfaatkan algoritma enkripsi AES-Rijndael yang yang diterapkan dalam arsitektur client-server dengan memanfaatkan protokol transmisi RTP, RTSP dalam kontrol alur media, dan hashing SHA-256 untuk memvalidasi setiap frame video, enkripsi AES-Rijndael akan digunakan untuk mengubah data dari format file video berekstensi Mjpeg. Algoritma AES-Rijndael mampu mengamankan data dan informasi video dengan baik, ketika client memasukkan kunci dekripsi yang berbeda, frame video yang dikirimkan dari server tidak dapat didekripsi dan ditampilkan secara utuh. Pengujian hashing SHA-256 dilakukan pada 25 dan 50 frame dari video untuk mengecek keaslian data berjalan dengan baik tanpa ada perubahan pada data frame yang dikirimkan.;
Analysis of User Acceptance of Open Source Software (OSS) Using Task Technology Fit (TTF) and Unified Theory of Acceptance and Use of Technology 2 (UTAUT 2) Model;https://jurnal.unimed.ac.id/2012/index.php/cess/article/view/35233/pdf;https://sinta.kemdikbud.go.id/journals/profile/207?page=16#!;CESS (Journal of Computer Engineering, System and Science) Vol 7, No 2 (2022): July 2022 368-383;2022;DOI: 10.24114/cess.v7i2.35233;Accred : Sinta 4;﻿OSS OPAC UNTAN merupakan katalog bersama yang digunakan untuk melakukan proses penelusuran koleksi di perpustakaan Universitas Tanjungpura. Namun, masih banyak kekurangan dari sistem yang dirasakan oleh pemustaka maupun pustakawan seperti ketidaktahuan cara kerja OPAC, antarmuka OPAC, infrastruktur hingga fitur-fitur yang disediakan oleh OPAC sehingga berujung pada pengguna yang terus berkutat pada adaptasi lama. Hal tersebut secara tidak langsung mempengaruhi pengguna dalam menggunakan sistem tersebut, sehingga penelitian ini dilakukan untuk mengetahui sejauh mana penerimaan pengguna terhadap OSS OPAC UNTAN dan faktor-faktor apa saja yang mempengaruhi pengguna dalam menggunakan OSS OPAC UNTAN. Model yang digunakan yaitu pengintegrasian antara model Task Technology Fit (TTF) dan Unified Theory of Acceptance and Use of Technology 2 (UTAUT 2) dengan 11 faktor model yang meliputi Task Characteristics, Technology Characteristics, Task Technology Fit, Performance Expectancy, Effort Expectancy, Social Influence, Facilitating Conditions, Hedonic Motivation, Learning Value, Habit, dan Behavioral Intention. Teknik analisis data menggunakan pendekatan Partial Least Square- Structural Equation Modelling (PLS-SEM) dengan bantuan tools SmartPLS 3. Hasil penelitian ini menunjukkan terdapat 5 hipotesis yang diterima dari 12 hipotesis yang telah dibangun dengan faktor model Habit, Task Technology Fit, Effort Expectancy, Performance Expectancy, dan Technology Characteristics berpengaruh secara signifikan terhadap penerimaan pengguna. Faktor model yang mempengaruhi menjadi evaluasi terhadap OSS OPAC UNTAN dengan harapan dapat dijadikan pengambilan keputusan bagi pihak pengembang dalam meningkatkan karakteristik teknologi, fitur-fitur, maupun layanan sehingga dapat di manfaatkan oleh pengguna dan beroperasi secara maksimal.;
K-Nearest Neighbor's Accuracy in Dermatic Bacterial Disease Diagnosis Results;https://jurnal.unimed.ac.id/2012/index.php/cess/article/view/34855/pdf;https://sinta.kemdikbud.go.id/journals/profile/207?page=16#!;CESS (Journal of Computer Engineering, System and Science) Vol 7, No 2 (2022): July 2022 384-393;2022;DOI: 10.24114/cess.v7i2.34855;Accred : Sinta 4;﻿Penelitian ini membahas dan memaparkan tentang mencari nilai akurasi dari metode K- Nearest Neighbor dalam menghasilkan kesimpulan. Hal ini perlu dilakukan untuk mengetahui efektivitas metode tersebut dalam menyelesaikan permasalahan yang terjadi. Dalam penelitian ini akan dilakukan perhitungan nilai akurasi dengan menggunakan studi kasus identifikasi penyakit Dermatic Bacterial. Pemilihan kasus ini didasari dengan fakta bahwa sulitnya melakukan diagnosis melalui gejela-gejala yang terjadi serta penanganan dini terhadap penyakit tersebut. Masalah yang terjadi dikarenakan keterbatasan pengetahuan masyakarat serta keterbatasan para ahli yang berada di berbagai daerah. Penelitian ini diawali dengan pengumpulan data kasus, gejala dan penyakit pada Dermatic Bacterial, selanjutnya membentuk basis pengetahuan berdasarkan data kasus. Proses tersebut dilanjutkan dengan melakukan perhitungan dengan menggunakan metode K-Nearest Neighbor. Setelah memperoleh hasil diagnosa berdasarkan perhitungan yang telah dilakukan menggunakan metode K-Nearest Neighbor maka proses selanjutnya adalah mencari nilai akurasi hasil diagnosa yang akan dibandingkan dengan hasil diagnosa pakar. Pada penelitian ini menggunakan 10 data sampel riwayat kasus sebelumnya dan 20 sampel untuk data pengujian. Dari proses pengujian yang dilakukan maka diketahui bahwa untuk nilai akurasi pada metode K-Nearest Neighbor sebesar 85%, sehingga dapat disimpulkan bahwa metode K-Nearest Neighbor sangat baik digunakan dalam melakukan perhitungan hasil diagnosa sebagai bagian dari diagnosa awal dan penanganan dini terhadap pasien.;
Dashboard System for Predicting Student Practicum Performance Using the Data Mining Method;https://jurnal.unimed.ac.id/2012/index.php/cess/article/view/35394/pdf;https://sinta.kemdikbud.go.id/journals/profile/207?page=15#!;CESS (Journal of Computer Engineering, System and Science) Vol 7, No 2 (2022): July 2022 394-406;2022;DOI: 10.24114/cess.v7i2.35394;Accred : Sinta 4;﻿Salah satu faktor yang dapat mempengaruhi keberhasilan suatu lembaga pendidikan adalah kualitas siswanya. Untuk dapat melihat kualitas siswanya dapat dilihat dari kelulusan yang diperoleh. Salah satu metode yang dapat digunakan untuk melihat persentase kelulusan siswa yang diperoleh adalah data mining. Penelitian ini dilakukan untuk mengkaji proses penilaian data dengan menggunakan metode data mining serta visualisasi data sehingga informasi yang dihasilkan lebih baik dengan menggunakan Dashboard. Metode Decision Tree dipilih karena hasil diperoleh dengan menggunakan sumber data yang menghasilkan Akurasi tertinggi. Dari penelitian ini, ditemukan bahwa Dashboard yang dikembangkan untuk memvisualisasikan data menjadi informasi yang lebih matang dan penilaian data menggunakan metode data mining, telah berhasil membuat para pemangku kepentingan mendapatkan informasi yang lebih baik dan juga membantu dalam pengambilan keputusan bisnis yang lebih baik.;
