ar-title;ar-title href;ar-meta href;ar-pub;ar-year;ar-cited;ar-quartile;abstract;
Analisis Insertion Mutation pada Sistem Penjadwalan Mata Kuliah;https://jurnal.unimed.ac.id/2012/index.php/cess/article/view/15161/pdf;https://sinta.kemdikbud.go.id/journals/profile/207?page=22#!;CESS (Journal of Computer Engineering, System and Science) Vol 5, No 2 (2020): JULI 2020 245-250;2020;DOI: 10.24114/cess.v5i2.15161;Accred : Sinta 3;Penjadwalan mata kuliah merupakan pekerjaan rutin yang selalu dilakukan setiap perguruan tinggi pada awal semester yang menjadi pekerjaan yang rumit dikarenakan persoalan penjadwalan merupakan masalah kombinatorial yang memiliki batasan- batasan yang harusdipenuhi. Penjadwalan memiliki peranan penting dalam pengelolaan suatu perguruan tinggi dimana masalah penjadwalan termasuk permasalahan kompleks yang menjadi bagian penting dari operasinya. Sistem penjadwalan yang selama ini berjalan di Sekolah Tinggi Teknologi (STT) Dumai dilakukan secara acak yang menyita banyak waktu dan sumber daya. Hal ini mengakibatkan perkuliahan kurang efektif karena harus melakukan penjadwalan ulang sesuai keadaan dan kebutuhan kampus. Oleh karena itu, diperlukan suatu bentuk pengembangan sistem penjadwalan mata kuliah dimana sistem tersebut dapat secara terstruktur membantu menyusun jadwal mata kuliah berdasarkan faktor penentu serta ruang populasi yang ada, dan memungkinkan terjadinya perubahan jadwal yang lebih dinamis, cepat dengan memperhatikan faktor penentu yang sama serta dapat memberikan gambaran kompleksitas permasalahan beban permasalahan terhadap ketersediaan sumber daya di STT Dumai. Pemilihan jenis mutasi dalam algoritma genetika menjadi pilihan yang perlu diperhatikan guna mendapatkan hasil optimal. Hasil penelitian menyatakan sistem penjadwalan mata kuliah dengan insertion mutation dapat memenuhi semua batasan dengan hasil yang lebih optimal.;
Aplikasi Filling Rekam Medis Menggunakan Metode Algoritma Turbo Boyer Moore;https://jurnal.unimed.ac.id/2012/index.php/cess/article/view/17565/pdf;https://sinta.kemdikbud.go.id/journals/profile/207?page=23#!;CESS (Journal of Computer Engineering, System and Science) Vol 5, No 2 (2020): JULI 2020 259-266;2020;DOI: 10.24114/cess.v5i2.17565;Accred : Sinta 3;Puskesmas Nagaswidak merupakan salah satu pusat kesehatan masyarakat yang cukup besar dan memiliki fasilitas yang lengkap. Namun permasalahan yang sering dihadapi para petugas dipuskesmas yakni sistem pengolahan data rekam medis yang masih manual sehingga menyebabkan adanya penumpukan data berkas rekam medis pasien, selain itu pasien yang telah di cek sebelumnya dan kehilangan nomor medrek (medical record) mereka, sangat menyulitkan petugas untuk mencari nya kembali, sehingga petugas membuatkan data rekam medis yang baru. Untuk mengatasi masalah tersebut, maka dibuatlah Aplikasi Filling Rekam Medis pada Puskesmas Nagaswidak yang mencakup pengolahan rekam medis, data pasien, data obat, data tindakan, data dokter, dan login admin. Agar masalah pencarian data tidak sulit maka diterapkan metode algoritma turbo boyer moore yang diharapkan nantinya dapat mempermudah pencarian data pasien dalam aplikasi filling rekam medis. Berdasarkan hasil uji coba Algoritma Boyer Moore berhasil di implementasikan untuk pencarian di awal kata, tengah kata, dan akhir kata. Dan tingkat kemudahan dan tingkat kegunaan aplikasi rekam medis dengan menggunakan algoritma Boyer Moore didapatkan hasil bahwa tingkat kemudahan yaitu 80% dan tingkat kegunaan 100%.;
Analisis Kinerja dalam Mendeteksi Student Loses Berdasarkan Nilai Gain dengan Splite Feature Reduction Model pada Algoritma C4,5;https://jurnal.unimed.ac.id/2012/index.php/cess/article/downloadSuppFile/17667/1958;https://sinta.kemdikbud.go.id/journals/profile/207?page=22#!;CESS (Journal of Computer Engineering, System and Science) Vol 5, No 2 (2020): JULI 2020 267-272;2020;DOI: 10.24114/cess.v5i2.17667;Accred : Sinta 3;"Perguruan tinggi diharapkan mampu menghasilkan sumber daya manusia yang berpengetahuan juga kreatif. faktor penilaian perguruan tinggi adalah persentase kemampuan mahasiswa dalam menyelesaikan studi. Saat ini, masalah student loses dan faktor-faktor yang mempengaruhinya telah menjadi topik yang menarik untuk diteliti. Institusi perlu mendeteksi kinerja mahasiswa yang berstatus ""student loses"" sehingga dapat diidentifikasi. Dengan metode klasifikasi algoritma C4.5 dalam mengambil keputusan yang dianggap memiliki kinerja yang baik, tetapi algoritma C4.5 memiliki beberapa kelemahan terhadap data yang tidak seimbang, yaitu dataset yang berbeda dua kelas yang berbeda antara kelas mayoritas dan kelas minoritas, berpengaruh pada algoritma C4.5, yang menghasilkan nilai hasil akurasi kurang optimal pada algoritma C4,5 untuk mengurangi pengaruh ketidakseimbangan kelas pada klasifikasi C4.5, maka perlu dilakukan pendekatan metode Split Feature Reduction Model hal ini dilakukan untuk memberi bobot pada setiap fitur yang direkomendasikan, sehingga ditemukan fitur yang merupakan klasifikasi yang kuat, berdasarkan perangkingan pada setiap fitur agar dapat direkomendasikan pada klasifikasi C4.5 dalam proses klasifikasi Hasil menunjukkan bahwa, kinerja akurasi klasifikasi C4.5 pada dataset mahasiswa dengan pendekatan SFRM sebelum proses Pengujian, 10 fold cross-validation, menunjukkan tingkat akurasi klasifikasi yang lebih baik yaitu akurasi 98% dalam penanganan ketidakseimbangan kelas.";
Kombinasi Algoritma Brute Force dan Stemming pada Sistem Pencarian Mashdar;https://jurnal.unimed.ac.id/2012/index.php/cess/article/view/17989/pdf;https://sinta.kemdikbud.go.id/journals/profile/207?page=26#!;CESS (Journal of Computer Engineering, System and Science) Vol 5, No 2 (2020): JULI 2020 273-278;2020;DOI: 10.24114/cess.v5i2.17989;Accred : Sinta 3;Penelitian ini mengkombinasikan algoritma Brute Force dan Stemming pada sistem pencarian kata mashdar. Tujuan penelitian ini adalah untuk memudahkan pengguna dalam mencari kata dasar dari suatu kata beserta dengan perubahannya dengan berdasarkan tinjauan kata dasar kepada mashdar. Adapun data yang digunakan dalam penelitian ini diperoleh dari kitab Tashrif karangan Syeikh Hasan bin Ahmad sebanyak 50 data. Hasil penelitian dengan mengkombinasikan algoritma brute force dan stemming pada pencarian mashdar dengan sample pengujian sebanyak 15 kata maka diperoleh nilai akurasi sebanyak 78.9%, precission 86.6%, recall 84.6% dan specificity 66.6%.;
Komparasi Performa Metode 6to4 dan Kombinasi L2TP/IPSec untuk Implementasi IPv6 pada Jaringan Komputer;https://jurnal.unimed.ac.id/2012/index.php/cess/article/downloadSuppFile/18116/2058;https://sinta.kemdikbud.go.id/journals/profile/207?page=24#!;CESS (Journal of Computer Engineering, System and Science) Vol 5, No 2 (2020): JULI 2020 279-284;2020;DOI: 10.24114/cess.v5i2.18116;Accred : Sinta 3;Seiring dengan peningkatan pengguna internet, kebutuhan pengalamatan Internet Protocol versi 4 (IPv4) semakin meningkat sehingga dikhawatirkan ketersediaannya akan semakin berkurang dan habis. Kehadiran Internet Protocol versi 6 (IPv6) yang merupakan protokol pengalamatan internet generasi terbaru, ditujukan untuk menggantikan penggunaan IPv4 saat ini. Namun, dalam implementasinya masih terdapat beberapa kendala yang salah satunya adalah kondisi infrastruktur yang saat ini yang belum banyak mendukung implementasi IPv6 sehingga proses migrasi IPv4 ke IPv6 menjadi sangat sulit. Pada akhirnya diterapkanlah metode transisi IPv6 untuk melakukan koneksi terhadap infrastruktur IPv4. Teknik 6to4 dan L2TP/IPSec merupakan metode tunneling yang mampu melakukan transisi dari IPv4 ke IPv6. Dalam penelitian ini, dilakukan komparasi terhadap kedua metode tersebut dengan melakukan pengukuran throughput, delay dan packet loss dengan berbagai skenario koneksi jaringan. Berdasarkan hasil dari percobaan yang dilakukan, diketahui bahwa penerapan teknik L2TP/IPSec menghasilkan kualitas koneksi yang lebih baik daripada kualitas koneksi penerapan teknik 6to4.;
Analisis Sentimen Zoom Cloud Meetings di Play Store Menggunakan NaÃ¯ve Bayes dan Support Vector Machine;https://jurnal.unimed.ac.id/2012/index.php/cess/article/downloadSuppFile/18186/2087;https://sinta.kemdikbud.go.id/journals/profile/207?page=23#!;CESS (Journal of Computer Engineering, System and Science) Vol 5, No 2 (2020): JULI 2020 293-298;2020;DOI: 10.24114/cess.v5i2.18186;Accred : Sinta 3;Aplikasi zoom cloud meetings yang mulai booming digunakan sekarang ini karena adanya pandemi virus corona, sehingga membuat semua kegiatan dilakukan secara virtual. Zoom cloud meetings merupakan aplikasi yang memiliki berbagai fitur termasuk video & audio conference. Pada penelitian ini penulis menggunakan metode Naïve Bayes dan Support Vector Machine dalam menganalisa label sentimen positif atau negatif pada ulasan para pengguna aplikasi zoom di Google Play Store. Jumlah dataset setelah prepocessing menjadi 1.007 record. Data hampir seimbang dengan label positif sebanyak 546 dan label negatif 461 ulasan. Evaluasi model menggunakan 10 fold cross validation diperoleh nilai akurasi dan nilai AUC dari masing- masing algoritma yaitu untuk NB nilai akurasi = 74,37% dan nilai AUC = 0,659. Sedangkan untuk algoritma SVM nilai akurasi = 81,22% dan nilai AUC = 0,886. Dalam penelitian ini dapat diketahui bahwa tingkat akurasi yang didapatkan algoritma Support Vector Machine (SVM) lebih unggul 6,85% dibandingkan algoritma Naïve Bayes (NB).;
Sistem Pendukung Keputusan Menentukan Tempat KKN (Kuliah Kerja Nyata) Menggunakan Metode Logika Fuzzy;https://jurnal.unimed.ac.id/2012/index.php/cess/article/view/19665/14058;https://sinta.kemdikbud.go.id/journals/profile/207?page=24#!;CESS (Journal of Computer Engineering, System and Science) Vol 5, No 2 (2020): JULI 2020 299-304;2020;DOI: 10.24114/cess.v5i2.19665;Accred : Sinta 3;Sebagai mahasiswa dituntut untuk dapat melakukan dan mengaplikasikan ilmu atau keahliannya kepada masyarakat. Siswa sebagai simbol perubahan oleh karena itu siswa sangat berpengaruh untuk mengembangkan tempat-tempat yang masih memiliki pendidikan dan teknologi yang rendah. Berdasarkan data yang diperoleh dari akademisi, Universitas Asahan mengirimkan mahasiswanya ke suatu tempat yang layak untuk dikembangkan. Hal tersebut menjadikan Universitas Asahan harus memiliki sistem yang dapat menempatkan mahasiswanya ke lokasi Kuliah Kerja Nyata secara adil. Fungsi dari aplikasi ini adalah untuk mengetahui penempatan mahasiswa dalam Kuliah Kerja Nyata dengan menggunakan metode logika fuzzy yang mampu menyelesaikan masalah.;
Implementasi Algoritma Luc Pada Aplikasi Keamanan Short Message Service (SMS) Berbasis Android;https://jurnal.unimed.ac.id/2012/index.php/cess/article/view/21862/pdf;https://sinta.kemdikbud.go.id/journals/profile/207?page=20#!;CESS (Journal of Computer Engineering, System and Science) Vol 6, No 1 (2021): Januari 2021 101-113;2021;DOI: 10.24114/cess.v6i1.21862;Accred : Sinta 4;Short Message Service (SMS) masih memiliki masalah keamanan terhadap upaya pencurian pesan, penyadapan pesan, pembajakan pesan oleh pihak yang tidak bertanggung jawab untuk mendapatkan suatu informasi. Kriptografi adalah ilmu untuk menjaga kerahasiaan informasi dari aspek yang dapat mengancam keamanan informasi dengan algoritma dan teknik matematika tertentu. Algoritma Luc merupakan algoritma kriptografi kunci publik yang dikembangkan dengan menggunakan fungsi lucas. Penelitian ini bertujuan untuk mengimplementasikan algoritma Luc pada aplikasi keamanan SMS yang berbasis android di Badan Narkotika Nasional Provinsi Sulawesi Tengah untuk menjaga privasi dalam berkomunikasi antara pengirim dan penerima pesan. Aplikasi ini dibuat menggunakan pengembang android studio dengan bahasa pemrograman java. Berdasarkan hasil pengujian pertama untuk sampel pesan plain pada kata KOTA PALU yang menggunakan kunci publik 13 menghasilkan pesan cipher P=Se!cQa. Hasil pengujian kedua untuk sampel pesan pada kata KOTA PALU yang menggunakan kunci publik 29 menghasilkan pesan cipher AD*`_$(NQ.;
Sistem Pendukung Keputusan Tingkat Kepuasan Pasien terhadap Mutu Pelayanan Rumah Sakit berdasarkan Metode ServQual;https://jurnal.unimed.ac.id/2012/index.php/cess/article/view/21023/pdf;https://sinta.kemdikbud.go.id/journals/profile/207?page=21#!;CESS (Journal of Computer Engineering, System and Science) Vol 6, No 1 (2021): Januari 2021 10-19;2021;DOI: 10.24114/cess.v6i1.21023;Accred : Sinta 4;Pengukuran tingkat kepuasan pasien akan pelayan yang diberikan oleh institusi rumah sakit akan menjadi tolak ukur dalam meningkatkan mutu pelayanan. Teknologi informasi dan komunikasi dapat dimanfaatkan untuk mempercepat proses pengukuran mulai dari pengumpulan data hingga mendapatkan hasil analisis yang dapat digunakan sebagai data pendukung dalam pengambilan keputusan. Sistem pendukung keputusan yang ter komputerisasi dirancang memanfaatkan diagram-diagram yang ada pada Unified Modelling Language (UML) sebelum dikembangkan menjadi sebuah perangkat lunak. Hasil dari penelitian ini berupa perangkat lunak yang dikembangkan dari perancangan yang terstruktur yang dapat digunakan sebagai alat pengumpulan data kemudian mengolahnya hingga menganalisis data menjadi informasi yang akurat untuk digunakan dalam pengambilan keputusan.;
Sistem Manajemen Persediaan pada Bunda Bakery dengan Mengimplementasikan Material Requirement Planning (MRP);https://jurnal.unimed.ac.id/2012/index.php/cess/article/view/20188/pdf;https://sinta.kemdikbud.go.id/journals/profile/207?page=21#!;CESS (Journal of Computer Engineering, System and Science) Vol 6, No 1 (2021): Januari 2021 114-121;2021;DOI: 10.24114/cess.v6i1.20188;Accred : Sinta 4;Bunda Bakery merupakan bakery yang telah beroperasi sejak tahun 2017. Bunda Bakery memproduksi rotinya berdasarkan asumsi pemiliknya dan menyebabkan proses produksi yang tidak teratur. Sering terjadi overproduksi sehingga roti yang dihasilkan tidak layak untuk dijual. Hal ini juga mempengaruhi jumlah persediaan bahan baku yang tidak terkendali. Oleh karena itu diperlukan suatu sistem yang dapat membantu dalam pengendalian pasokan bahan baku dengan menggunakan teknik perhitungan Material Requirement Planning (MRP). Implementasi MRP juga didukung dengan menggunakan metode peramalan Single Exponential Smoothing dan metode Lot Sizing Fixed Order Quantity. Berdasarkan hasil pengujian yang dilakukan terhadap sistem informasi yang dibangun dengan menggunakan pengujian blackbox didapatkan bahwa 100% fungsionalitas sistem berjalan dengan baik. Pengujian penerimaan pengguna (UAT) yang dilakukan menunjukkan bahwa sistem yang dibangun dapat diterima oleh pengguna. Selanjutnya pengujian perbandingan akurasi metode menunjukkan bahwa hasil perhitungan yang ditampilkan pada sistem sudah akurat. Dan pengujian terakhir adalah uji usability, hasil pengujian menunjukkan rata-rata 89.95% pengguna sangat setuju dengan pembangunan sistem ini.;
Aplikasi Penentuan Kelayakan Penerima Kredit pada Kopdit Swasti Sari Menggunakan Metode Profile Matching;https://jurnal.unimed.ac.id/2012/index.php/cess/article/view/21645/pdf;https://sinta.kemdikbud.go.id/journals/profile/207?page=18#!;CESS (Journal of Computer Engineering, System and Science) Vol 6, No 1 (2021): Januari 2021 122-126;2021;DOI: 10.24114/cess.v6i1.21645;Accred : Sinta 4;KSP Kopdit Swasti Sari adalah salah satu koperasi kredit yang ada di Nusa Tenggara Timur. Salah satu kegiatan yang dilakukan oleh KSP Kopdit Swasti Sari untuk meningkatkan kesejahteraan anggotanya adalah memberikan kredit kepada anggotanya. Tapi prosedur pelayanan kredit di KSP Kopdit Swasti Sari masih belum efektif dan efisien. Oleh karena itu KSP Kopdit Swasti Sari membutuhkan suatu metode yang terkomputerisasi guna mengefisiensi kinerjanya. Metode Profile Matching dalam sistem pendukung keputusan adalah salah satu metode yang dapat diterapkan guna memberikan solusi terhadap masalah yang ada. Sistem ini mampu menentukan anggota yang layak menerima kredit selain itu juga memudahkan anggota dalam proses administrasi seperti pendaftaran dan transaksi.;
Perangkat Lunak Simulasi Pesawat Melalui Navaid;https://jurnal.unimed.ac.id/2012/index.php/cess/article/downloadSuppFile/22341/2964;https://sinta.kemdikbud.go.id/journals/profile/207?page=20#!;CESS (Journal of Computer Engineering, System and Science) Vol 6, No 1 (2021): Januari 2021 133-138;2021;DOI: 10.24114/cess.v6i1.22341;Accred : Sinta 4;Menjadi penerbang adalah merupakan cita-cita banyak orang, tetapi banyak kendala yang harus dihadapi yang utama adalah perlu biaya yang besar untuk menjadi seorang pilot. Dikarenakan pendidikan pilot perlu menggunakan peralatan yang mahal seperti praktek terbang menggunakan pesawat terbang. Sebelum melakukan praktek terbang, calon pilot belajar terbang dengan menggunakan simulator pesawat. Dalam penerbangan pilot dapat menggunakan instrument Navaids terletak di darat untuk terbang dari satu bandara ke bandara lainnya, penerbangan menggunakan Navaid divisualisasikan dengan instrument HSI dalam cockpit pesawat. Visualisasi jarum instrument HSI dapat memandu pilot mendekati Navaids yang menjadi tujuan. Penelitian dilakukan dengan membuat perangkat lunak simulasi pesawat mendekati Navaids (VOR dan NDB) dengan menggunakan instrument HSI. Metode pengembangan perangkat lunak menggunakan Metoda Prototype. Hasil perangkat lunak yang dikembangkan dibandingkan dengan perangkat lunak Garmin ternyata hasil visualisasi yang diperoleh adalah sama dengan perangkat lunak pembanding.;
Klasifikasi Kebakaran Hutan Dan Lahan Menggunakan Algoritma NaÃ¯ve Bayes Di Kabupaten Pelalawan;https://jurnal.unimed.ac.id/2012/index.php/cess/article/view/22555/pdf;https://sinta.kemdikbud.go.id/journals/profile/207?page=20#!;CESS (Journal of Computer Engineering, System and Science) Vol 6, No 1 (2021): Januari 2021 139-148;2021;DOI: 10.24114/cess.v6i1.22555;Accred : Sinta 4;Kebakaran hutan dan lahan merupakan salah satu masalah lingkungan dalam hal ekonomis dan ekologis yang merugikan. Jumlah hotspot kebakaran hutan di Provinsi Riau telah meningkat secara dramatis menyebabkan kabut asap yang berbahaya. Penelitian ini bertujuan untuk mengklasifikasi kebakaran hutan dan lahan di Kabupaten Pelalawan, Riau. Penelitian ini telah menggunakan 792 data dalam lima tahun (2015-2019). Model klasifikasi kebakaran hutan menggunakan algoritma Naïve Bayes. Atribut yang digunakan untuk klasifikasi terdiri dari suhu, kelembaban, curah hujan, kecepatan angin, dan kelas dari keempat faktor tersebut didapatkan hasil probabilitas tertinggi yaitu suhu dengan nilai 0.978260870 dan nilai akurasi tertinggi adalah dataset tahun 2017 dengan nilai akurasi adalah 81.03% sehingga nilai akurasi tertinggi tersebut dapat diterapkan pada dataset baru yaitu pada tahun 2019 dengan nilai akurasi nya adalah 82%. Dengan demikian, dapat disimpulkan bahwa model klasifikasi menggunakan Naïve Bayes memiliki potensi untuk digunakan secara efektif sehingga dapat membantu pihak berwenang dalam mencegah kebakaran hutan dan lahan.;
Pemodelan Identifikasi Trafik Bittorrent Dengan Pendekatan Correlation Based Feature Selection (CFS) Menggunakan Algoritme Decision Tree (C4.5);https://jurnal.unimed.ac.id/2012/index.php/cess/article/view/20855/pdf;https://sinta.kemdikbud.go.id/journals/profile/207?page=18#!;CESS (Journal of Computer Engineering, System and Science) Vol 6, No 1 (2021): Januari 2021 1-9;2021;DOI: 10.24114/cess.v6i1.20855;Accred : Sinta 4;BitTorrent merupakan protokol P2P file sharing perangkat lunak yang memungkinkan client mendistribusikan data ke client lainnya dan dapat mempengaruhi kinerja layanan jaringan. Pengambilan data trafik client BitTorrent menggunakan data sekunder yang diambil dari sumber resmi pada link https://unb.ca/cic/datasets/index.html pada tahun 2016. Data trafik digunakan sebagai model identifkasi trafik BitTorrent menggunakan correlation based feature selection (CFS) dan analisis model identifikasi trafik menggunakan Algoritme Decision Tree (C4.5). Seleksi fitur dilakukan guna membersihkan fitur-fitur yang tidak relevan sehingga dapat mempengaruhi hasil nilai accuracy. Hasil seleksi fitur didapat 7 fitur dan 1 kategori dengan 244.689 record dan identifikasi menentukan model rule tree training data dipilih empat nilai accuracy terbaik. Selanjutnya model training data dilakukan uji testing data, guna identifikasi trafik BitTorrent. Hasil uji testing data didapatlah nilai accuracy trafik BitTorrent terbaik 98.82% dengan jumlah data 73.406 record pada uji testing data 30%.;
Rancang Bangun Dan Pengujian Kualitas Aplikasi Web E-Recruitment Berdasarkan ISO/IEC 9126 Pada Suatu Perusahaan Pembiayaan Di Indonesia;https://jurnal.unimed.ac.id/2012/index.php/cess/article/view/19773/pdf;https://sinta.kemdikbud.go.id/journals/profile/207?page=20#!;CESS (Journal of Computer Engineering, System and Science) Vol 6, No 1 (2021): Januari 2021 20-29;2021;DOI: 10.24114/cess.v6i1.19773;Accred : Sinta 4;Penelitian ini bertujuan untuk merancang, membuat, dan menguji kualitas aplikasi web e-recruitment pada suatu perusahaan pembiayaan di Indonesia berdasarkan ISO/IEC 9126. Metode yang digunakan dalam penelitian ini adalah Research and Development (R&D) meliputi identifikasi potensi dan masalah, analisis kebutuhan dan pengumpulan data, desain aplikasi, implementasi, validasi aplikasi, revisi aplikasi, dan uji coba aplikasi. Pembuatan aplikasi web e- recruitment menggunakan LAMP (Linux, Apache, MySQL, PHP). Pengujian kualitas aplikasi berdasarkan 6 faktor yaitu functionality, reliability, efficiency, usability, maintainability, dan portability. Faktor functionality diuji menggunakan black box testing. Faktor efficiency diuji menggunakan GT Metrix (Yslow) dan Page Speed Insight. Faktor reliability diuji menggunakan stress testing (LoadStrom, LoadImpact, dan WAPT 8.1). Faktor maintainability diuji berdasarkan aspek instrumentation, consistency, dan simplicity. Faktor portability diuji menggunakan beberapa web browser dan faktor usability menggunakan Computer System Usability Questionnaire. Berdasarkan hasil penelitian yang telah dilakukan, aplikasi web e-recruitment mampu berjalan dengan baik dengan beberapa revisi dari ahli rekrutmen dan ahli pemrograman. Hasil pengujian kualitas aplikasi berdasarkan ISO/IEC 9126 telah memenuhi standar faktor kualitas aplikasi dari faktor functionality, reliability, usability, maintainability, dan portability. Faktor efficiency masih belum memenuhi standar faktor kualitas aplikasi.;
Analisis Pola Dan Dampak Serangan Cryptojacking Dengan Menggunakan Pendekatan Dynamic Analysis;https://jurnal.unimed.ac.id/2012/index.php/cess/article/view/20008/pdf;https://sinta.kemdikbud.go.id/journals/profile/207?page=18#!;CESS (Journal of Computer Engineering, System and Science) Vol 6, No 1 (2021): Januari 2021 39-47;2021;DOI: 10.24114/cess.v6i1.20008;Accred : Sinta 4;"""Miners"" bekerja untuk memecahkan masalah matematika yang kompleks untuk menghasilkan pendapatan dalam bentuk mata uang digital, seperti Bitcoin, Ethereum, Monero, dan lainnya. Proses mining ini membutuhkan perangkat keras yang serius dan sumber daya CPU yang signifikan untuk menciptakan cryptocurrency. Cryptojacking salah satu alat penambangan mata uang digital secara illegal. Cryptojacking dapat memberikan return yang lebih substansial bagi penyerang. Cryptominer jenis ini tidak terlalu membahayakan secara langsung kepada para korbannya, tetapi hanya saja menggunakan akses ilegal ke komputer korban dan menggunakan sumber daya korban untuk menambang crypto. Metode yang digunakan adalah dynamic analysis. Dinamic Analysis adalah mencari informasi atau sampel mengenai malware dengan cara menjalankannya. Dengan metode ini dapat terlihat ""perilaku” dari malware tersebut sehingga selanjutnya dapat dianalisa dampak yang terjadi. Pengujian malware ini dilakukan dengan 2 cara yaitu pengujian pertama dilakukan dengan javascript injection pada jaringan lokal yang sama dengan korban yaitu wifi publik dan pengujian kedua dengan mengakses website yang terindikasi skrip cryptojacking. Berdasarkan hasil analisis menggunakan dynamic analysis dimana cryptojacking dapat menginfeksi langsung ke website atau melalui jaringan local dengan javascript injection, jika website telah terinfeksi cryptojacking maka pengunjung dari website tersebut akan menjadi korban dan terjadi penambangan tersembunyi yang akan memakan sumber daya korban dan cryptojacking operator dalang dibalik website yang terinfeksi akan menerima keuntungan dalam bentuk mata uang digital dari hasil cryptojacking ini.";
